{
  "schema_version": 1,
  "id": "ai-agent-kit-capability-coverage-v1.6",
  "target_version": "1.6.0",
  "external_source_lock": "config/external-skill-sources.lock.json",
  "routing_config": "config/skill-routing.json",
  "skill_catalog": {
    "animation-design-engineering": {"introduced_in": "1.0.0", "dispatch_mode": "EXPLICIT_ONLY", "capability": "experience-engineering"},
    "approve-product-baseline": {"introduced_in": "1.6.0", "dispatch_mode": "ROUTED", "capability": "product-genesis"},
    "assess-product-viability": {"introduced_in": "1.6.0", "dispatch_mode": "ROUTED", "capability": "product-genesis"},
    "assure-product-trust": {"introduced_in": "1.6.0", "dispatch_mode": "ROUTED", "capability": "product-genesis"},
    "architecture-diagrams": {"introduced_in": "1.0.0", "dispatch_mode": "COMPOSED", "capability": "architecture"},
    "architecture-review": {"introduced_in": "1.0.0", "dispatch_mode": "COMPOSED", "capability": "architecture"},
    "audit-plugin-trust": {"introduced_in": "1.2.0", "dispatch_mode": "ROUTED", "capability": "plugin-assurance"},
    "author-governed-plugin": {"introduced_in": "1.1.0", "dispatch_mode": "ROUTED", "capability": "plugin-assurance"},
    "benchmark-agent-reliability": {"introduced_in": "1.2.0", "dispatch_mode": "ROUTED", "capability": "agent-assurance"},
    "change-impact-plan": {"introduced_in": "1.0.0", "dispatch_mode": "COMPOSED", "capability": "engineering-delivery"},
    "code-quality-review": {"introduced_in": "1.0.0", "dispatch_mode": "COMPOSED", "capability": "engineering-assurance"},
    "code-review": {"introduced_in": "1.0.0", "dispatch_mode": "ROUTED", "capability": "engineering-assurance"},
    "compile-task-context": {"introduced_in": "1.0.0", "dispatch_mode": "COMPOSED", "capability": "agent-runtime"},
    "control-product-change": {"introduced_in": "1.6.0", "dispatch_mode": "ROUTED", "capability": "product-genesis"},
    "database-change": {"introduced_in": "1.0.0", "dispatch_mode": "EXPLICIT_ONLY", "capability": "engineering-delivery"},
    "delivery-documentation": {"introduced_in": "1.0.0", "dispatch_mode": "COMPOSED", "capability": "engineering-delivery"},
    "demo-evidence-package": {"introduced_in": "1.0.0", "dispatch_mode": "COMPOSED", "capability": "engineering-assurance"},
    "design-document": {"introduced_in": "1.0.0", "dispatch_mode": "COMPOSED", "capability": "architecture"},
    "design-scalable-systems": {"introduced_in": "1.0.0", "dispatch_mode": "ROUTED", "capability": "architecture"},
    "design-taste-website": {"introduced_in": "1.0.0", "dispatch_mode": "EXPLICIT_ONLY", "capability": "experience-engineering"},
    "discuss-product-idea": {"introduced_in": "1.6.0", "dispatch_mode": "ROUTED", "capability": "product-genesis"},
    "final-implementation-review": {"introduced_in": "1.0.0", "dispatch_mode": "COMPOSED", "capability": "engineering-assurance"},
    "fix-bug": {"introduced_in": "1.0.0", "dispatch_mode": "ROUTED", "capability": "engineering-delivery"},
    "governed-action-gateway": {"introduced_in": "1.0.0", "dispatch_mode": "COMPOSED", "capability": "agent-runtime"},
    "governed-agent-runtime": {"introduced_in": "1.0.0", "dispatch_mode": "COMPOSED", "capability": "agent-runtime"},
    "humanize-writing": {"introduced_in": "1.0.0", "dispatch_mode": "EXPLICIT_ONLY", "capability": "content-integrity"},
    "implement-feature": {"introduced_in": "1.0.0", "dispatch_mode": "ROUTED", "capability": "engineering-delivery"},
    "investigate-agent-runtime": {"introduced_in": "1.2.0", "dispatch_mode": "ROUTED", "capability": "agent-assurance"},
    "jira-completion-package": {"introduced_in": "1.0.0", "dispatch_mode": "COMPOSED", "capability": "engineering-delivery"},
    "marketing-growth-website": {"introduced_in": "1.0.0", "dispatch_mode": "EXPLICIT_ONLY", "capability": "content-integrity"},
    "observability-review": {"introduced_in": "1.0.0", "dispatch_mode": "COMPOSED", "capability": "engineering-assurance"},
    "operate-product": {"introduced_in": "1.6.0", "dispatch_mode": "ROUTED", "capability": "product-genesis"},
    "orchestrate-agent-department": {"introduced_in": "1.0.0", "dispatch_mode": "ROUTED", "capability": "team-orchestration"},
    "performance-investigation": {"introduced_in": "1.0.0", "dispatch_mode": "COMPOSED", "capability": "engineering-assurance"},
    "plan-product-delivery": {"introduced_in": "1.6.0", "dispatch_mode": "ROUTED", "capability": "product-genesis"},
    "prepare-production-readiness": {"introduced_in": "1.6.0", "dispatch_mode": "ROUTED", "capability": "product-genesis"},
    "production-incident": {"introduced_in": "1.0.0", "dispatch_mode": "EXPLICIT_ONLY", "capability": "engineering-operations"},
    "release-readiness": {"introduced_in": "1.0.0", "dispatch_mode": "COMPOSED", "capability": "engineering-operations"},
    "repository-health": {"introduced_in": "1.0.0", "dispatch_mode": "COMPOSED", "capability": "repository-intelligence"},
    "repository-intelligence": {"introduced_in": "1.0.0", "dispatch_mode": "COMPOSED", "capability": "repository-intelligence"},
    "research-product-opportunity": {"introduced_in": "1.6.0", "dispatch_mode": "ROUTED", "capability": "product-genesis"},
    "run-product-genesis": {"introduced_in": "1.6.0", "dispatch_mode": "ROUTED", "capability": "product-genesis"},
    "run-product-iteration": {"introduced_in": "1.6.0", "dispatch_mode": "ROUTED", "capability": "product-genesis"},
    "resume-and-recover-run": {"introduced_in": "1.1.0", "dispatch_mode": "ROUTED", "capability": "run-continuity"},
    "review-product-outcome": {"introduced_in": "1.6.0", "dispatch_mode": "ROUTED", "capability": "product-genesis"},
    "retire-product": {"introduced_in": "1.6.0", "dispatch_mode": "ROUTED", "capability": "product-genesis"},
    "security-review": {"introduced_in": "1.0.0", "dispatch_mode": "ROUTED", "capability": "engineering-assurance"},
    "seo-geo-website": {"introduced_in": "1.0.0", "dispatch_mode": "ROUTED", "capability": "content-integrity"},
    "start-product": {"introduced_in": "1.6.0", "dispatch_mode": "ROUTED", "capability": "product-genesis"},
    "start-task": {"introduced_in": "1.0.0", "dispatch_mode": "ROUTED", "capability": "engineering-delivery"},
    "test-strategy": {"introduced_in": "1.0.0", "dispatch_mode": "COMPOSED", "capability": "engineering-assurance"},
    "threat-model": {"introduced_in": "1.0.0", "dispatch_mode": "COMPOSED", "capability": "engineering-assurance"},
    "trace-decisions-and-runs": {"introduced_in": "1.1.0", "dispatch_mode": "ROUTED", "capability": "run-continuity"},
    "validate-product-discovery": {"introduced_in": "1.6.0", "dispatch_mode": "ROUTED", "capability": "product-genesis"},
    "write-business-requirements": {"introduced_in": "1.6.0", "dispatch_mode": "ROUTED", "capability": "product-genesis", "source_ids": ["github-awesome-copilot-prd"]},
    "write-product-content": {"introduced_in": "1.4.1", "dispatch_mode": "ROUTED", "capability": "content-integrity"},
    "write-product-specification": {"introduced_in": "1.6.0", "dispatch_mode": "ROUTED", "capability": "product-genesis", "source_ids": ["github-awesome-copilot-prd"]},
    "zero-trust-mcp": {"introduced_in": "1.0.0", "dispatch_mode": "COMPOSED", "capability": "agent-runtime"}
  },
  "capabilities": [
    {
      "id": "product-genesis",
      "stage": "idea-to-production",
      "skills": ["run-product-genesis", "start-product", "discuss-product-idea", "research-product-opportunity", "validate-product-discovery", "assess-product-viability", "assure-product-trust", "write-business-requirements", "write-product-specification", "approve-product-baseline", "plan-product-delivery", "run-product-iteration", "control-product-change", "prepare-production-readiness", "operate-product", "review-product-outcome", "retire-product"],
      "required_artifacts": [
        "core/product-genesis.md",
        "rules/product-evidence-integrity.md", "rules/product-production-evidence-integrity.md", "rules/requirements-integrity.md", "rules/product-approval-integrity.md", "rules/product-research-privacy.md", "rules/product-delivery-integrity.md",
        "quality-profiles/product-genesis.yaml", "quality-profiles/product-discovery.yaml", "quality-profiles/business-analysis.yaml", "quality-profiles/requirements-engineering.yaml", "quality-profiles/product-delivery.yaml",
        "guards/product-genesis-stage-gate.yaml", "guards/product-baseline-approval-gate.yaml", "guards/product-evidence-binding-gate.yaml",
        "workflows/product-genesis.md", "workflows/validate-product-discovery.md", "workflows/research-product-opportunity.md", "workflows/establish-product-baseline.md", "workflows/deliver-approved-product.md", "workflows/run-product-iteration.md", "workflows/prepare-product-production.md", "workflows/control-product-change.md", "workflows/review-product-outcome.md",
        "templates/product-idea.schema.json", "templates/product-research.schema.json", "templates/business-requirements.schema.json", "templates/product-specification.schema.json", "templates/product-baseline-approval.schema.json", "templates/requirement-traceability.schema.json", "templates/product-delivery-backlog.schema.json", "templates/product-change.schema.json",